,Unnamed: 0,user_id,book_id,rating,goodreads_book_id,tag_id,count,genre_x,work_id,books_count,isbn,isbn13,authors,original_publication_year,original_title,title,language_code,average_rating,ratings_count,work_ratings_count,work_text_reviews_count,ratings_1,ratings_2,ratings_3,ratings_4,ratings_5,image_url
6629,6629,15,6644,5,146064,21689,302,nonfiction,2421914,23,1582433542,9780000000000.0,Julia Scheeres,2005.0,Jesus Land : A Memoir,Jesus Land,en-US,3.97,13562,14456,1449,200,623,3122,6041,4470,https://s.gr-assets.com/assets/nophoto/book/111x148-bcc042a9c91a29c1d680899eff700a03.png
6644,6644,46391,6659,5,26200563,21689,1123,nonfiction,46177490,12,1455539740,9780000000000.0,"Lin-Manuel Miranda, Jeremy McCarter",2016.0,Hamilton: The Revolution,Hamilton: The Revolution,eng,4.47,24800,25565,3339,693,530,1834,5496,17012,https://images.gr-assets.com/books/1451400644m/26200563.jpg
6655,6655,2591,6670,1,760941,21689,242,nonfiction,1264345,19,515103292,9780000000000.0,"Truddi Chase, Robert A. Phillips Jr.",1980.0,When Rabbit Howls,When Rabbit Howls,en-GB,4.03,13975,14372,499,253,655,3077,4825,5562,https://s.gr-assets.com/assets/nophoto/book/111x148-bcc042a9c91a29c1d680899eff700a03.png
6662,6662,13935,6677,3,10256723,21689,461,nonfiction,15156997,27,316037702,9780000000000.0,"Kevin D. Mitnick, William L. Simon, Steve Wozniak",2011.0,Ghost in the Wires: My Adventures as the World's Most Wanted Hacker,Ghost in the Wires: My Adventures as the World's Most Wanted Hacker,en-US,3.95,12831,14993,1287,393,770,3019,5860,4951,https://images.gr-assets.com/books/1344265017m/10256723.jpg
6672,6672,523,6687,4,7332753,21689,457,nonfiction,8987023,44,446540331,9780000000000.0,Christopher Hitchens,2010.0,Hitch-22: Some Confessions and Contradictions,Hitch-22: A Memoir,eng,4.03,12643,14373,1122,252,579,2673,5873,4996,https://images.gr-assets.com/books/1327906136m/7332753.jpg
6689,6689,206,6704,4,139569,21689,85,nonfiction,1523329,14,1555838537,9780000000000.0,Leslie Feinberg,1993.0,Stone Butch Blues,Stone Butch Blues,en-US,4.27,13570,13969,760,197,411,1948,4256,7157,https://images.gr-assets.com/books/1328758827m/139569.jpg
6699,6699,11044,6714,3,20897517,21689,593,nonfiction,28027377,18,385535376,9780000000000.0,Hampton Sides,2014.0,In the Kingdom of Ice: The Grand and Terrible Polar Voyage of the USS Jeannette,In the Kingdom of Ice: The Grand and Terrible Polar Voyage of the USS Jeannette,eng,4.18,11444,13550,1809,280,424,1771,5139,5936,https://images.gr-assets.com/books/1395935993m/20897517.jpg
6721,6721,3544,6736,4,367802,23471,2,philosophy,357793,37,811202054,9780000000000.0,Dylan Thomas,1952.0,Collected Poems,Collected Poems,eng,4.2,13188,13796,213,109,354,2339,4869,6125,https://s.gr-assets.com/assets/nophoto/book/111x148-bcc042a9c91a29c1d680899eff700a03.png
6731,6731,361,6746,5,23316,21689,383,nonfiction,1360829,20,312274920,9780000000000.0,Tony Hawks,1997.0,Round Ireland with a Fridge,Round Ireland with a Fridge,en-US,3.78,13143,14015,795,310,969,3816,5297,3623,https://s.gr-assets.com/assets/nophoto/book/111x148-bcc042a9c91a29c1d680899eff700a03.png
6733,6733,13729,6748,3,18127101,21689,179,nonfiction,25461047,16,1455599735,9780000000000.0,Chelsea Handler,2014.0,Uganda Be Kidding Me,Uganda Be Kidding Me,eng,3.63,11627,13595,1208,479,1378,4081,4382,3275,https://images.gr-assets.com/books/1403174817m/18127101.jpg
6735,6735,7578,6750,4,6386555,21689,397,nonfiction,6574787,7,1416544208,9780000000000.0,Chuck Klosterman,2009.0,Eating the Dinosaur,Eating the Dinosaur,eng,3.75,12571,13386,891,187,824,3817,5823,2735,https://images.gr-assets.com/books/1327949106m/6386555.jpg
6749,6749,5295,6764,4,15833693,21689,235,nonfiction,21570166,20,62217208,9780000000000.0,Amanda Knox,2013.0,Waiting to Be Heard: A Memoir,Waiting to Be Heard: A Memoir,eng,3.8,11891,13198,1322,374,880,3350,4936,3658,https://images.gr-assets.com/books/1367786694m/15833693.jpg
6789,6789,3160,6804,5,12143200,21689,731,nonfiction,17113518,13,307970388,9780000000000.0,Rachel Maddow,2012.0,Drift: The Unmooring of American Military Power,Drift: The Unmooring of American Military Power,eng,4.07,12980,14938,1870,360,605,2349,6001,5623,https://images.gr-assets.com/books/1318753897m/12143200.jpg
6805,6805,38,6820,4,1875,21689,423,nonfiction,5991,67,679724699,9780000000000.0,"Michel Foucault, Robert Hurley",1976.0,Histoire de la sexualité 1. La Volonté de savoir,"The History of Sexuality, Volume 1: An Introduction",eng,4.03,12565,13935,548,201,630,2708,5339,5057,https://images.gr-assets.com/books/1486236798m/1875.jpg
6809,6809,1608,6824,5,10677213,21773,49,nonfiction,15586908,19,375507485,9780000000000.0,"Steven Naifeh, Gregory White Smith",2011.0,Van Gogh: The Life,Van Gogh: The Life,eng,4.09,13659,14020,309,538,707,2300,3940,6535,https://images.gr-assets.com/books/1411005913m/10677213.jpg
6847,6847,6066,6862,5,17346698,21689,875,nonfiction,24086771,11,1603093001,9780000000000.0,"John             Lewis, Andrew Aydin, Nate Powell",2013.0,March: Book One,"March: Book One (March, #1)",eng,4.33,19430,19871,2753,412,414,1814,6699,10532,https://images.gr-assets.com/books/1360539808m/17346698.jpg
6851,6851,2856,6866,3,8242117,21689,402,nonfiction,13089627,27,307595609,9780000000000.0,Nora Ephron,2010.0,I remember nothing and other reflections,I Remember Nothing: and Other Reflections,en-US,3.73,13875,15822,2279,249,1211,4769,5913,3680,https://images.gr-assets.com/books/1320544923m/8242117.jpg
6853,6853,18285,6868,5,28257707,21689,753,nonfiction,48297245,24,006245773X,9780000000000.0,Mark Manson,2016.0,The Subtle Art of Not Giving a F*ck: A Counterintuitive Approach to Living a Good Life,The Subtle Art of Not Giving a F*ck: A Counterintuitive Approach to Living a Good Life,eng,4.03,41087,48659,3569,1484,2534,8529,16518,19594,https://images.gr-assets.com/books/1465761302m/28257707.jpg
6860,6860,2921,6875,3,1009996,21689,110,nonfiction,996120,4,312362919,9780000000000.0,"Jeff Hertzberg, Zoë François, Mark Luinenburg",2007.0,,Artisan Bread in Five Minutes a Day: The Discovery That Revolutionizes Home Baking,eng,4.11,13984,14173,581,423,642,2287,4473,6348,https://images.gr-assets.com/books/1317064461m/1009996.jpg
6864,6864,2429,6879,4,8649656,21689,610,nonfiction,13520837,26,718154835,9780000000000.0,Stephen Fry,2010.0,The Fry Chronicles: An Autobiography,The Fry Chronicles (Memoir #2),eng,3.87,14037,15730,998,262,844,3743,6632,4249,https://images.gr-assets.com/books/1376317909m/8649656.jpg
6865,6865,324,6880,3,448836,23471,597,philosophy,86945,181,915144867,9780000000000.0,"John Locke, C.B. Macpherson",1689.0,Second Treatise of Government,Second Treatise of Government,eng,3.75,14549,15287,215,479,1181,4276,5093,4258,https://images.gr-assets.com/books/1405624453m/448836.jpg
6867,6867,3219,6882,3,6966823,21773,412,nonfiction,7205526,57,393072223,9780000000000.0,Nicholas Carr,2010.0,The Shallows: What the Internet is Doing to Our Brains,The Shallows: What the Internet is Doing to Our Brains,eng,3.85,6938,15090,2107,308,933,3625,6106,4118,https://images.gr-assets.com/books/1368393880m/6966823.jpg
6870,6870,237,6885,2,522534,21689,589,nonfiction,18133,61,743444299,9780000000000.0,"Mineko Iwasaki, Rande Brown",2002.0,Geisha: A Life,"Geisha, a Life",en-US,3.92,12995,15656,1005,175,811,3820,6065,4785,https://images.gr-assets.com/books/1359402937m/522534.jpg
6871,6871,493,6886,5,666758,21689,96,nonfiction,1313,45,60684127,9780000000000.0,A.W. Tozer,1961.0,The Knowledge of the Holy: The Attributes of God: Their Meaning in the Christian Life,The Knowledge of the Holy,eng,4.37,13800,14753,526,260,395,1662,3800,8636,https://images.gr-assets.com/books/1411484750m/666758.jpg
6878,6878,6773,6893,4,9739365,21689,193,nonfiction,14628458,32,031269945X,9780000000000.0,"Howard E. Wasdin, Stephen Templin",2011.0,SEAL Team Six: Memoirs of an Elite Navy SEAL Sniper,SEAL Team Six: Memoirs of an Elite Navy SEAL Sniper,en-US,4.0,10582,11895,800,161,542,2571,4455,4166,https://s.gr-assets.com/assets/nophoto/book/111x148-bcc042a9c91a29c1d680899eff700a03.png
6879,6879,4131,6894,5,190115,21689,63,nonfiction,183830,18,609810111,9780000000000.0,Caroline Myss,2001.0,Sacred Contracts: Awakening Your Divine Potential,Sacred Contracts: Awakening Your Divine Potential,en-US,3.97,12218,12481,191,252,786,2753,4008,4682,https://s.gr-assets.com/assets/nophoto/book/111x148-bcc042a9c91a29c1d680899eff700a03.png
6880,6880,126,6895,3,4955,21689,9,nonfiction,1014179,26,1400095565,9780000000000.0,Dave Eggers,2005.0,How We Are Hungry,How We Are Hungry,eng,3.75,11282,12077,715,163,781,3678,4767,2688,https://s.gr-assets.com/assets/nophoto/book/111x148-bcc042a9c91a29c1d680899eff700a03.png
6881,6881,212,6896,4,30292,23471,801,philosophy,30661,25,872206335,9780000000000.0,"Plato, G.M.A. Grube, John M. Cooper",-385.0,"Euthyphro, Apology, Crito, Meno, Phaedo","Five Dialogues: Euthyphro, Apology, Crito, Meno, Phaedo",eng,4.1,13301,13633,187,160,535,2692,4632,5614,https://images.gr-assets.com/books/1399079227m/30292.jpg
6890,6890,47245,6905,4,25422234,21689,910,nonfiction,44611586,10,62415832,9780000000000.0,"Irin Carmon, Shana Knizhnik",2015.0,,Notorious RBG: The Life and Times of Ruth Bader Ginsburg,eng,4.22,15626,17642,2701,202,370,2324,7132,7614,https://s.gr-assets.com/assets/nophoto/book/111x148-bcc042a9c91a29c1d680899eff700a03.png
6898,6898,2810,6913,3,25403,23471,105,philosophy,1015565,85,753819929,9780000000000.0,"Jostein Gaarder, James Anderson",2003.0,Appelsinpiken,The Orange Girl,eng,3.91,10355,15802,1355,275,1033,3697,5620,5177,https://images.gr-assets.com/books/1415583796m/25403.jpg
6906,6906,59,6921,4,46349,21689,289,nonfiction,45472,28,812968379,9780000000000.0,Firoozeh Dumas,2003.0,Funny in Farsi: A Memoir of Growing Up Iranian in America,Funny in Farsi: A Memoir of Growing Up Iranian in America,eng,3.76,10008,13656,1957,253,941,3805,5460,3197,https://images.gr-assets.com/books/1411923160m/46349.jpg
6913,6913,404,6928,5,299215,21689,360,nonfiction,217623,102,226320618,9780000000000.0,Friedrich A. Hayek,1944.0,The Road to Serfdom,The Road to Serfdom,en-US,4.18,11306,13889,820,299,546,2016,4540,6488,https://images.gr-assets.com/books/1327787673m/299215.jpg
6917,6917,136,6932,5,12468,21689,411,nonfiction,838965,33,375700811,9780000000000.0,Norman Mailer,1979.0,The Executioner's Song,The Executioner's Song,eng,4.07,13829,15169,970,244,677,2693,5730,5825,https://images.gr-assets.com/books/1325755176m/12468.jpg
6922,6922,2323,6937,5,840,21689,328,nonfiction,18518,38,465067107,9780465067110.0,Donald A. Norman,1988.0,The Psychology of Everyday Things,The Design of Everyday Things,en-US,4.18,11838,15202,1192,88,483,2327,6020,6284,https://s.gr-assets.com/assets/nophoto/book/111x148-bcc042a9c91a29c1d680899eff700a03.png
6930,6930,2136,6945,4,42631,21689,88,nonfiction,209794,20,1578562589,9780000000000.0,Joanna Weaver,2000.0,Having a Mary Heart in a Martha World: Finding Intimacy With God in the Busyness of Life,Having a Mary Heart in a Martha World: Finding Intimacy With God in the Busyness of Life,en-US,4.16,12501,12838,412,149,469,2232,4284,5704,https://images.gr-assets.com/books/1341472478m/42631.jpg
6934,6934,6504,6949,5,12171769,21689,252,nonfiction,17143199,6,1433672960,9780000000000.0,Jen Hatmaker,2011.0,,7: An Experimental Mutiny Against Excess,eng,4.13,13434,14325,1476,335,681,2206,4671,6432,https://images.gr-assets.com/books/1328764395m/12171769.jpg
6948,6948,2357,6963,1,434764,21689,120,nonfiction,862892,9,1570089264,9780000000000.0,Stephen E. Robinson,1992.0,Believing Christ: The Parable of the Bicycle and Other Good News,Believing Christ: The Parable of the Bicycle and Other Good News,eng,4.51,12951,13348,818,164,220,1010,3223,8731,https://s.gr-assets.com/assets/nophoto/book/111x148-bcc042a9c91a29c1d680899eff700a03.png
6951,6951,2149,6966,5,17994,21689,934,nonfiction,1031975,64,385495323,9780000000000.0,Simon Singh,1999.0,"The Code Book. How to Make It, Break It, Hack It, Crack It",The Code Book: The Science of Secrecy from Ancient Egypt to Quantum Cryptography,eng,4.28,12919,15365,912,85,290,1889,6053,7048,https://images.gr-assets.com/books/1403181687m/17994.jpg
6963,6963,5014,6978,3,609035,21689,84,nonfiction,3016652,239,800786645,9780000000000.0,"John Foxe, W. Grinton Berry",1563.0,Foxe's Book of Martyrs,Foxe's Book of Martyrs,en-CA,4.25,12117,13581,254,194,493,2106,3784,7004,https://s.gr-assets.com/assets/nophoto/book/111x148-bcc042a9c91a29c1d680899eff700a03.png
6969,6969,514,6984,2,6617185,21689,245,nonfiction,6811292,38,1568584253,9780000000000.0,"Simon Kuper, Stefan Szymanski",2009.0,"Soccernomics: Why England Loses, Why Germany and Brazil Win, and Why the U.S., Japan, Australia, Turkey--and Even Iraq--Are Destined to Become the Kings of the World's Most Popular Sport","Soccernomics: Why England Loses, Why Germany and Brazil Win, and Why the U.S., Japan, Australia, Turkey--and Even Iraq--Are Destined to Become the Kings of the World's Most Popular Sport",en-US,3.91,10577,11824,541,278,586,2796,4406,3758,https://s.gr-assets.com/assets/nophoto/book/111x148-bcc042a9c91a29c1d680899eff700a03.png
6973,6973,2301,6988,4,1587362,21689,94,nonfiction,1580303,13,764524836,9780000000000.0,Mark Bittman,2007.0,How to Cook Everything Vegetarian: Simple Meatless Recipes for Great Food,How to Cook Everything Vegetarian: Simple Meatless Recipes for Great Food,eng,4.08,12262,12372,366,416,524,2113,3916,5403,https://s.gr-assets.com/assets/nophoto/book/111x148-bcc042a9c91a29c1d680899eff700a03.png
6975,6975,4030,6990,3,17349222,21689,471,nonfiction,18373204,18,62236679,9780000000000.0,Ann Patchett,2011.0,This Is the Story of a Happy Marriage,This is the Story of a Happy Marriage,eng,4.03,13126,15190,2565,241,633,2731,6347,5238,https://images.gr-assets.com/books/1375215541m/17349222.jpg
6980,6980,975,6995,3,434535,21773,24,nonfiction,2243662,11,1590382234,9780000000000.0,James L. Ferrell,2004.0,The Peacegiver: How Christ Offers to Heal Our Hearts and Homes,The Peacegiver: How Christ Offers to Heal Our Hearts and Homes,eng,4.41,12313,12528,2150,144,325,1324,3252,7483,https://s.gr-assets.com/assets/nophoto/book/111x148-bcc042a9c91a29c1d680899eff700a03.png
6982,6982,7898,6997,5,8167094,21689,422,nonfiction,13013056,38,307265633,9780000000000.0,Brian Greene,2011.0,The Hidden Reality: Parallel Universes and the Search for the Deep Laws of the Cosmos,The Hidden Reality: Parallel Universes and the Deep Laws of the Cosmos,eng,4.05,12080,13031,581,263,515,2415,4987,4851,https://images.gr-assets.com/books/1320431300m/8167094.jpg
6983,6983,610,6998,3,38723,21689,593,nonfiction,809732,68,393322572,9780000000000.0,"Betty Friedan, Anna Quindlen",1963.0,The Feminine Mystique,The Feminine Mystique,eng,3.85,9823,16455,1137,283,1001,4182,6432,4557,https://images.gr-assets.com/books/1479777578m/38723.jpg
6986,6986,3006,7001,5,6452760,21689,488,nonfiction,6642965,34,670021156,9780000000000.0,"Greg Mortenson, Khaled Hosseini",2009.0,"Stones into Schools: Promoting Peace with Books, Not Bombs, in Afghanistan and Pakistan","Stones Into Schools: Promoting Peace With Books, Not Bombs, in Afghanistan and Pakistan",eng,3.86,13543,14741,1786,430,907,3490,5407,4507,https://images.gr-assets.com/books/1260845553m/6452760.jpg
7030,7030,5170,7046,4,543103,21689,413,nonfiction,908023,28,042520040X,9780000000000.0,Evan Wright,2004.0,Generation Kill,"Generation Kill: Devil Dogs, Iceman, Captain America, and the New Face of American War",en-US,4.25,11680,13447,747,55,288,1819,5303,5982,https://s.gr-assets.com/assets/nophoto/book/111x148-bcc042a9c91a29c1d680899eff700a03.png
7033,7033,53004,7049,5,25733983,21689,900,nonfiction,45572105,27,1101874937,9780000000000.0,Hope Jahren,2016.0,Lab Girl,Lab Girl,eng,4.04,16594,19798,3321,425,900,3506,7585,7382,https://images.gr-assets.com/books/1441826687m/25733983.jpg
7043,7043,267,7059,2,12542,21689,230,nonfiction,1057710,16,1594489424,9780000000000.0,Anne Lamott,2007.0,Grace [Eventually]: Thoughts on Faith,Grace (Eventually): Thoughts on Faith,en-US,3.98,12863,13561,1053,215,636,2927,5235,4548,https://s.gr-assets.com/assets/nophoto/book/111x148-bcc042a9c91a29c1d680899eff700a03.png
7044,7044,4671,7060,5,335459,21689,26,nonfiction,325931,3,307354164,9780000000000.0,Martha Stewart,2007.0,Everyday Food: Great Food Fast,Everyday Food: Great Food Fast,eng,3.93,11969,11973,145,394,752,2625,3689,4513,https://images.gr-assets.com/books/1320479731m/335459.jpg
7070,7070,1068,7086,3,99955,23471,268,philosophy,23681298,16,451528891,9780000000000.0,"Thomas Paine, Sidney Hook, Jack Fruchtman Jr.",1776.0,,"Common Sense, The Rights of Man and Other Essential Writings",eng,4.12,13088,13165,122,103,465,2593,4529,5475,https://images.gr-assets.com/books/1309203355m/99955.jpg
7087,7087,89,7103,3,6678,21689,312,nonfiction,1413831,68,141311428,9780000000000.0,"Roald Dahl, Quentin Blake",1986.0,Going Solo,Going Solo,eng,4.04,14086,16071,986,146,656,3345,6185,5739,https://s.gr-assets.com/assets/nophoto/book/111x148-bcc042a9c91a29c1d680899eff700a03.png
7095,7095,3507,7111,3,4485966,21689,319,nonfiction,4642546,33,1591842247,9780000000000.0,Geoff Colvin,2008.0,Talent Is Overrated: What Really Separates World-Class Performers from Everybody Else,Talent is Overrated: What Really Separates World-Class Performers from Everybody Else,en-US,3.96,12511,13454,816,201,656,3024,5118,4455,https://s.gr-assets.com/assets/nophoto/book/111x148-bcc042a9c91a29c1d680899eff700a03.png
7099,7099,10311,7115,4,62103,21689,40,nonfiction,60356,6,805017224,9780000000000.0,"George C. Perry, Clive Barda, Jane Rice, Andrew Lloyd Webber",1987.0,The Complete Phantom of the Opera,The Complete Phantom of the Opera,eng,4.29,13681,13752,58,199,456,1923,3728,7446,https://s.gr-assets.com/assets/nophoto/book/111x148-bcc042a9c91a29c1d680899eff700a03.png
7113,7113,18683,7129,5,6791212,21689,34,nonfiction,6995232,38,230744273,9780000000000.0,Martin Sixsmith,2009.0,"The Lost Child of Philomena Lee: A Mother, Her Son And A Fifty Year Search","The Lost Child of Philomena Lee: A Mother, Her Son and a 50 Year Search",eng,3.65,7261,12619,1583,659,1226,3265,4203,3266,https://images.gr-assets.com/books/1338612242m/6791212.jpg
7115,7115,11170,7131,4,1432370,21689,283,nonfiction,1422905,34,786868910,9780000000000.0,Liz Murray,2010.0,"Breaking Night: A Memoir of Forgiveness, Survival, and My Journey from Homeless to Harvard","Breaking Night: A Memoir of Forgiveness, Survival, and My Journey from Homeless to Harvard",en-US,4.19,12664,14186,1952,146,369,2065,5600,6006,https://s.gr-assets.com/assets/nophoto/book/111x148-bcc042a9c91a29c1d680899eff700a03.png
7135,7135,38,7151,3,123632,21689,304,nonfiction,1715933,55,440351839,9780000000000.0,"C.G. Jung, Joseph L. Henderson, Aniela Jaffé, Jolande Jacobi, John Freeman, Marie-Louise von Franz",1964.0,Man and His Symbols,Man and His Symbols,eng,4.18,12463,13625,426,146,453,2237,4787,6002,https://images.gr-assets.com/books/1327336291m/123632.jpg
7173,7173,21220,7189,5,15786110,21689,399,nonfiction,21505033,7,1596436239,9780000000000.0,Lucy Knisley,2013.0,,Relish: My Life in the Kitchen,eng,3.89,13518,13626,1678,581,826,2707,4874,4638,https://images.gr-assets.com/books/1345686126m/15786110.jpg
7182,7182,21,7198,3,51985,23471,1238,philosophy,2376452,78,300115466,9780000000000.0,"Jean-Paul Sartre, Arlette Elkaïm-Sartre, Annie Cohen-Solal, Carol Macomber",1946.0,L'Existentialisme est un humanisme ,Existentialism Is a Humanism,en-GB,3.96,12493,15055,569,228,704,3403,5788,4932,https://images.gr-assets.com/books/1328870158m/51985.jpg
7183,7183,16651,7199,2,15451058,21689,762,nonfiction,44904964,21,679456201,9780000000000.0,Gloria Steinem,2015.0,My Life on the Road,My Life on the Road,eng,4.08,15997,17852,2554,345,542,2967,7549,6449,https://images.gr-assets.com/books/1440005972m/15451058.jpg
7189,7189,345,7205,3,95643,21773,134,nonfiction,92181,25,156031566,9780000000000.0,Rory Stewart,2004.0,The Places In Between,The Places in Between,en-US,3.88,11445,11934,1274,222,786,2822,4500,3604,https://s.gr-assets.com/assets/nophoto/book/111x148-bcc042a9c91a29c1d680899eff700a03.png
7215,7215,136,7231,5,123845,23471,407,philosophy,1472936,36,486277909,9780000000000.0,Ralph Waldo Emerson,1844.0,Self-Reliance and Other Essays,Self-Reliance and Other Essays,en-US,4.14,14484,14717,282,154,542,2653,5092,6276,https://images.gr-assets.com/books/1319099192m/123845.jpg
7217,7217,1343,7233,4,769016,21689,429,nonfiction,2738870,61,380811960,9780000000000.0,"Adele Faber, Elaine Mazlish, Kimberly Ann Coe",1979.0,How to Talk So Teens Will Listen and Listen So Teens Will Talk,How to Talk So Kids Will Listen & Listen So Kids Will Talk,en-US,4.24,10931,13966,1547,114,414,1989,4997,6452,https://s.gr-assets.com/assets/nophoto/book/111x148-bcc042a9c91a29c1d680899eff700a03.png
7223,7223,177,7239,4,95420,21689,185,nonfiction,695094,22,375701044,9780000000000.0,Katharine Graham,1997.0,Personal History,Personal History,en-US,4.13,13714,14328,750,255,516,2360,5196,6001,https://images.gr-assets.com/books/1320504681m/95420.jpg
7226,7226,302,7242,4,291,23471,32,philosophy,1676536,119,806501901,9780806501900.0,"Kahlil Gibran, Anthony R. Ferris",1912.0,الأجنحة المتكسرة,The Broken Wings,eng,3.93,5611,12435,1425,272,792,2796,4251,4324,https://s.gr-assets.com/assets/nophoto/book/111x148-bcc042a9c91a29c1d680899eff700a03.png
7233,7233,6355,7249,3,100247,21689,334,nonfiction,96659,11,812992180,9780000000000.0,Rolf Potts,2002.0,Vagabonding: An Uncommon Guide to the Art of Long-Term World Travel,Vagabonding: An Uncommon Guide to the Art of Long-Term World Travel,eng,3.92,13128,14025,836,276,860,3243,4984,4662,https://images.gr-assets.com/books/1320532720m/100247.jpg
7241,7241,1836,7257,3,24476,21689,243,nonfiction,1596506,21,743406567,9780000000000.0,Chuck Klosterman,2001.0,Fargo Rock City: A Heavy Metal Odyssey in Rural North Dakota,Fargo Rock City: A Heavy Metal Odyssey in Rural North Dakota,en-US,3.8,11376,11665,532,225,752,3196,4486,3006,https://s.gr-assets.com/assets/nophoto/book/111x148-bcc042a9c91a29c1d680899eff700a03.png
7243,7243,7971,7259,3,6818019,21689,526,nonfiction,7026660,47,307589676,9780000000000.0,"Nujood Ali, Delphine Minoui, Linda Coverdale",2009.0,"Moi Nojoud, 10 ans, divorcée","I Am Nujood, Age 10 and Divorced",eng,3.79,13607,15351,2294,169,1002,4480,5895,3805,https://images.gr-assets.com/books/1320467214m/6818019.jpg
7257,7257,5295,7273,2,15771862,21689,423,nonfiction,21480584,36,,,Sonali Deraniyagala,2013.0,Wave,Wave,eng,3.7,12008,13198,2128,466,1217,3512,4626,3377,https://images.gr-assets.com/books/1362126716m/15771862.jpg
7259,7259,11594,7275,5,13547504,21689,763,nonfiction,19112644,30,743236718,9780000000000.0,Andrew Solomon,2012.0,"Far from the Tree: Parents, Children, and the Search for Identity","Far from the Tree: Parents, Children, and the Search for Identity",eng,4.26,11879,13240,1875,251,445,1677,4053,6814,https://images.gr-assets.com/books/1363008433m/13547504.jpg
7263,7263,7208,7279,5,13330771,21689,696,nonfiction,18538423,47,307957241,9780000000000.0,Oliver Sacks,1995.0,Hallucinations,Hallucinations,eng,3.85,11443,12886,1101,230,755,3348,4938,3615,https://images.gr-assets.com/books/1440360108m/13330771.jpg
7275,7275,397,7291,4,389763,21689,70,nonfiction,456945,27,1401911846,9780000000000.0,Wayne W. Dyer,1899.0,Change Your Thoughts - Change Your Life: Living the Wisdom of the Tao,Change Your Thoughts - Change Your Life: Living the Wisdom of the Tao,eng,4.24,11997,12818,383,218,383,1877,3988,6352,https://images.gr-assets.com/books/1328770256m/389763.jpg
7276,7276,18,7292,3,81176,21689,447,nonfiction,979931,57,446693790,9780000000000.0,Michael Moore,2003.0,"Dude, Where's My Country?","Dude, Where's My Country?",en-US,3.4,12468,13810,356,766,1678,4945,4172,2249,https://s.gr-assets.com/assets/nophoto/book/111x148-bcc042a9c91a29c1d680899eff700a03.png
7280,7280,1763,7297,4,163363,21689,235,nonfiction,1526762,20,809015803,9780000000000.0,Gerda Weissmann Klein,1959.0,All But My Life,All But My Life: A Memoir,en-US,4.28,13710,14111,893,268,398,1790,4332,7323,https://images.gr-assets.com/books/1316131452m/163363.jpg
7314,7314,6174,7331,3,5093760,21689,226,nonfiction,5160502,11,451226801,9780000000000.0,Jen Lancaster,2009.0,"Pretty in Plaid: A Life, a Witch, and a Wardrobe, or, the Wonder Years Before the Condescending, Egomanical, Self-Centered Smart-Ass Phase",Pretty in Plaid,eng,3.88,14860,15510,1089,217,960,4116,5450,4767,https://images.gr-assets.com/books/1484147603m/5093760.jpg
7315,7315,535,7332,5,180930,21689,237,nonfiction,503350,28,875421180,9780000000000.0,Scott Cunningham,1988.0,Wicca: A Guide for the Solitary Practitioner,Wicca: A Guide for the Solitary Practitioner,en-US,4.01,12264,12770,410,259,714,2737,3937,5123,https://s.gr-assets.com/assets/nophoto/book/111x148-bcc042a9c91a29c1d680899eff700a03.png
7322,7322,826,7339,5,3090282,21689,330,nonfiction,3121382,12,1416551050,9780000000000.0,Molly Wizenberg,2009.0,A Homemade Life: Stories and Recipes from My Kitchen Table,A Homemade Life: Stories and Recipes from My Kitchen Table,eng,3.94,13310,14009,1690,213,714,3168,5520,4394,https://s.gr-assets.com/assets/nophoto/book/111x148-bcc042a9c91a29c1d680899eff700a03.png
7324,7324,209,7341,3,26123,21689,260,nonfiction,26823,36,1400078393,9780000000000.0,Martin E.P. Seligman,1990.0,Learned Optimism: How to Change Your Mind and Your Life,Learned Optimism: How to Change Your Mind and Your Life,en-GB,3.98,11310,12096,540,243,630,2612,4291,4320,https://s.gr-assets.com/assets/nophoto/book/111x148-bcc042a9c91a29c1d680899eff700a03.png
7339,7339,24982,7356,5,16218778,21773,129,nonfiction,23326865,15,544025830,9780000000000.0,Kimberly Rae Miller,2013.0,,Coming Clean,en-US,3.88,10002,14943,1406,260,670,3640,6333,4040,https://images.gr-assets.com/books/1381962759m/16218778.jpg
7347,7347,2647,7364,5,216048,21773,14,nonfiction,209160,14,399237321,9780000000000.0,Patricia Polacco,1998.0,"Thank You, Mr. Falker","Thank You, Mr. Falker",en-US,4.52,13049,13604,881,131,272,1209,2735,9257,https://s.gr-assets.com/assets/nophoto/book/111x148-bcc042a9c91a29c1d680899eff700a03.png
