,Unnamed: 0,user_id,book_id,rating,goodreads_book_id,tag_id,count,genre_x,work_id,books_count,isbn,isbn13,authors,original_publication_year,original_title,title,language_code,average_rating,ratings_count,work_ratings_count,work_text_reviews_count,ratings_1,ratings_2,ratings_3,ratings_4,ratings_5,image_url
2663,2663,6977,2667,3,8592946,21689,365,nonfiction,13462590,30,310321913,9780000000000.0,Ann Voskamp,2011.0,One Thousand Gifts,One Thousand Gifts: A Dare to Live Fully Right Where You Are,eng,4.03,33960,35216,2918,1492,2377,5805,9323,16219,https://images.gr-assets.com/books/1393970725m/8592946.jpg
2668,2668,38693,2672,5,23513349,21689,380,nonfiction,43116473,27,1502784270,9780000000000.0,Rupi Kaur,2014.0,milk and honey,Milk and Honey,eng,4.27,73104,82204,10042,1693,3821,10197,21243,45250,https://images.gr-assets.com/books/1491595510m/23513349.jpg
2676,2676,212,2680,4,52309,21773,355,nonfiction,598905,834,743255062,9780000000000.0,"Benjamin Franklin, Lewis Leary",1791.0,,The Autobiography of Benjamin Franklin,eng,3.83,33061,43113,2159,1482,2925,10378,15150,13178,https://s.gr-assets.com/assets/nophoto/book/111x148-bcc042a9c91a29c1d680899eff700a03.png
2677,2677,108,2681,3,1858013,21689,317,nonfiction,2306323,39,525950494,9780000000000.0,Timothy J. Keller,2007.0,The Reason for God: Belief in an Age of Skepticism,The Reason for God: Belief in an Age of Skepticism,eng,4.2,31692,33938,1606,915,1296,4551,10606,16570,https://s.gr-assets.com/assets/nophoto/book/111x148-bcc042a9c91a29c1d680899eff700a03.png
2698,2698,1382,2702,3,6114607,21773,429,nonfiction,6292672,4,143116231,9780000000000.0,Jennifer Worth,2002.0, Call the midwife : a true story of the East End in the 1950s,"The Midwife: A Memoir of Birth, Joy, and Hard Times",en-US,4.17,19176,39141,5112,291,809,5844,17076,15121,https://s.gr-assets.com/assets/nophoto/book/111x148-bcc042a9c91a29c1d680899eff700a03.png
2703,2703,5039,2707,3,13707738,21689,687,nonfiction,14420600,45,393343448,9780000000000.0,Michael   Lewis,2011.0,Boomerang: Travels in the New Third World,Boomerang: Travels in the New Third World,eng,3.87,15616,32446,1933,884,1655,7380,13241,9286,https://images.gr-assets.com/books/1345046879m/13707738.jpg
2716,2716,3421,2720,3,639864,21689,249,nonfiction,2066960,210,876120834,9780000000000.0,Paramahansa Yogananda,1946.0,Autobiography of a Yogi,Autobiography of a Yogi,en-US,4.22,26713,31616,1408,752,1391,4587,8413,16473,https://s.gr-assets.com/assets/nophoto/book/111x148-bcc042a9c91a29c1d680899eff700a03.png
2728,2728,8,2732,5,18414,23471,1369,philosophy,2798280,810,140449108,9780000000000.0,"Thomas More, Paul Turner",1516.0,"Libellus vere aureus, nec minus salutaris quam festivus, de optimo rei publicae statu deque nova insula Utopia",Utopia,eng,3.5,36680,44234,1887,1177,5222,15801,14313,7721,https://s.gr-assets.com/assets/nophoto/book/111x148-bcc042a9c91a29c1d680899eff700a03.png
2735,2735,19363,2739,4,18813642,21689,2665,nonfiction,26563816,25,62282719,9780000000000.0,Roxane Gay,2014.0,Bad Feminist ,Bad Feminist,eng,3.91,41012,43890,5030,1046,2612,9283,17369,13580,https://images.gr-assets.com/books/1421292744m/18813642.jpg
2738,2738,8173,2742,5,9160695,21689,1028,nonfiction,14039744,49,1594202842,9780000000000.0,Amy Chua,2011.0,,Battle Hymn of the Tiger Mother,eng,3.61,34710,38736,6270,990,3331,12436,15039,6940,https://s.gr-assets.com/assets/nophoto/book/111x148-bcc042a9c91a29c1d680899eff700a03.png
2748,2748,13660,2752,5,18505796,21689,903,nonfiction,26365939,29,62265423,9780000000000.0,Dan   Harris,2014.0,"10% Happier: How I Tamed the Voice in My Head, Reduced Stress Without Losing My Edge, and Found Self-Help That Actually Works","10% Happier: How I Tamed the Voice in My Head, Reduced Stress Without Losing My Edge, and Found Self-Help That Actually Works",eng,3.93,33969,39748,3485,1106,2034,7948,15912,12748,https://images.gr-assets.com/books/1451446393m/18505796.jpg
2766,2766,18,2770,5,4979,21689,584,nonfiction,1119459,64,081297736X,9780000000000.0,Kurt Vonnegut Jr.,2005.0,A Man Without a Country,A Man Without a Country,eng,4.07,29859,32094,2044,192,1229,6362,12567,11744,https://images.gr-assets.com/books/1330997432m/4979.jpg
2773,2773,5711,2777,5,13414676,21689,143,nonfiction,18713903,41,307594033,9780000000000.0,Will Schwalbe,2012.0,The End of Your Life Bookclub,The End of Your Life Book Club,eng,3.81,35412,39636,6644,1016,2905,9783,14960,10972,https://images.gr-assets.com/books/1333576665m/13414676.jpg
2777,2777,8,2781,4,49221,21773,266,nonfiction,894384,87,60652381,9780000000000.0,C.S. Lewis,1961.0,A Grief Observed,A Grief Observed,en-US,4.26,35913,38154,1930,403,976,5410,12917,18448,https://images.gr-assets.com/books/1412529325m/49221.jpg
2790,2790,168,2794,3,30633,21689,82,nonfiction,14816053,85,6280897,9780000000000.0,C.S. Lewis,1960.0,The Four Loves,The Four Loves,en-US,4.16,29684,32510,1109,444,1001,5530,11563,13972,https://images.gr-assets.com/books/1276287504m/30633.jpg
2793,2793,2338,2797,3,10505,21689,252,nonfiction,2094829,50,847826465,9780000000000.0,"Umberto Eco, Girolamo De Michele, Alastair McEwen",2004.0,Storia della bellezza,History of Beauty,eng,3.77,33893,34445,169,2959,2615,6651,9310,12910,https://s.gr-assets.com/assets/nophoto/book/111x148-bcc042a9c91a29c1d680899eff700a03.png
2800,2800,10667,2804,4,18039963,21689,688,nonfiction,21979139,28,1451651694,9780000000000.0,"Amanda Lindhout, Sara Corbett",2013.0,A House in the Sky,A House in the Sky,eng,4.2,29369,33140,3574,481,955,4513,12644,14547,https://images.gr-assets.com/books/1370379455m/18039963.jpg
2814,2814,41711,2818,4,20821284,21689,652,nonfiction,39959105,17,399252517,9780000000000.0,Jacqueline Woodson,2014.0,Brown Girl Dreaming,Brown Girl Dreaming,eng,4.11,33779,37633,5349,1732,1625,4992,11824,17460,https://images.gr-assets.com/books/1424308405m/20821284.jpg
2837,2837,145,2841,4,7237456,21689,2157,nonfiction,8159756,36,393068471,9780000000000.0,Mary Roach,2010.0,Packing for Mars: The Curious Science of Life in the Void ,Packing for Mars: The Curious Science of Life in the Void,en-US,3.93,35724,38592,3737,861,1817,8333,15749,11832,https://images.gr-assets.com/books/1290480157m/7237456.jpg
2840,2840,1411,2844,5,408615,21689,531,nonfiction,69191,47,1401908977,9780000000000.0,"Immaculée Ilibagiza, Steve Erwin",2006.0,Left to Tell: Discovering God Amidst the Rwandan Holocaust,Left to Tell: Discovering God Amidst the Rwandan Holocaust,eng,4.43,30270,31952,4644,303,540,3066,9238,18805,https://images.gr-assets.com/books/1328860563m/408615.jpg
2851,2851,9178,2855,3,18667945,21689,368,nonfiction,26493608,35,039916927X,9780000000000.0,Sophia Amoruso,2014.0,,#GIRLBOSS,eng,3.71,40090,43741,2980,2080,4220,11094,13126,13221,https://images.gr-assets.com/books/1390931472m/18667945.jpg
2863,2863,639,2867,4,1319,21773,337,nonfiction,722104,29,446691437,9780000000000.0,"Steven Pressfield, Robert McKee",2002.0,The War of Art: Break Through the Blocks and Win Your Inner Creative Battles,The War of Art: Break Through the Blocks & Win Your Inner Creative Battles,en-US,4.07,31399,37038,3578,992,2088,6294,11688,15976,https://s.gr-assets.com/assets/nophoto/book/111x148-bcc042a9c91a29c1d680899eff700a03.png
2881,2881,4020,2885,4,3257136,21689,1397,nonfiction,3292360,103,446407410,9780000000000.0,"Vicki Myron, Bret Witter",2008.0,Dewey: The Small-Town Library Cat Who Touched the World,Dewey: The Small-Town Library Cat Who Touched the World,eng,3.85,40356,43295,5439,987,3336,10995,13816,14161,https://images.gr-assets.com/books/1398144610m/3257136.jpg
2891,2891,30698,2895,4,17331349,21689,316,nonfiction,24034629,48,62218360,9780000000000.0,"Steven D. Levitt, Stephen J. Dubner",2014.0,,Think Like a Freak,eng,3.82,25990,32724,2675,526,1711,9028,13187,8272,https://images.gr-assets.com/books/1395610974m/17331349.jpg
2893,2893,126,2897,3,3110,21773,731,nonfiction,824686,18,074326004X,9780000000000.0,Sarah Vowell,2005.0,Assassination Vacation,Assassination Vacation,en-US,3.98,32176,34125,3408,523,1545,6889,14274,10894,https://s.gr-assets.com/assets/nophoto/book/111x148-bcc042a9c91a29c1d680899eff700a03.png
2902,2902,9940,2906,5,21412202,21689,115,nonfiction,27029851,1,1476764026,9780000000000.0,"Cary Elwes, Joe Layden, Various, Rob Reiner",2014.0,As You Wish: Inconceivable Tales from the Making of The Princess Bride,As You Wish: Inconceivable Tales from the Making of The Princess Bride,eng,4.08,31886,34379,6019,811,1143,5803,13229,13393,https://images.gr-assets.com/books/1418103917m/21412202.jpg
2906,2906,69,2910,2,138269,21689,716,nonfiction,985716,73,1840187166,9780000000000.0,"Frank W. Abagnale, Stan Redding",1980.0,Catch Me If You Can,Catch Me If You Can: The True Story of a Real Fake,eng,4.05,32048,36201,1757,357,1326,7352,14245,12921,https://images.gr-assets.com/books/1358730242m/138269.jpg
2908,2908,3141,2912,3,119760,21689,130,nonfiction,1075398,45,684865181,9780000000000.0,Gary Zukav,1989.0,,The Seat of the Soul,en-US,3.97,29675,30840,497,759,1960,6680,9437,12004,https://s.gr-assets.com/assets/nophoto/book/111x148-bcc042a9c91a29c1d680899eff700a03.png
2917,2917,498,2921,5,395090,21689,28,nonfiction,1185316,67,60931728,9780000000000.0,Sylvia Plath,1965.0,Ariel,Ariel,eng,4.23,35566,38547,1072,626,1195,5497,12507,18722,https://images.gr-assets.com/books/1442258738m/395090.jpg
2921,2921,5295,2925,3,6534932,21689,294,nonfiction,6727073,11,345518519,9780000000000.0,Kathy Griffin,2009.0,Official Book Club Selection: A Memoir According to Kathy Griffin,Official Book Club Selection: A Memoir According to Kathy Griffin,en-US,3.8,31685,32718,1426,1304,2120,8243,11250,9801,https://s.gr-assets.com/assets/nophoto/book/111x148-bcc042a9c91a29c1d680899eff700a03.png
2922,2922,86,2926,4,240976,23471,106,philosophy,3428728,112,60932147,9780000000000.0,"Milan Kundera, Aaron Asher",1979.0,Kniha smíchu a zapomnění,The Book of Laughter and Forgetting,eng,4.01,28159,32303,1396,375,1322,6550,13528,10528,https://images.gr-assets.com/books/1446568718m/240976.jpg
2930,2930,100,2934,2,14142,21689,142,nonfiction,1561022,172,61129739,9780000000000.0,"Erich Fromm, Peter D. Kramer, Rainer Funk",1956.0,The Art of Loving,The Art of Loving,eng,4.01,29048,33263,1269,854,1739,6528,11105,13037,https://s.gr-assets.com/assets/nophoto/book/111x148-bcc042a9c91a29c1d680899eff700a03.png
2942,2942,1657,2946,3,66354,21689,755,nonfiction,64339,66,60920432,9780000000000.0,Mihaly Csikszentmihalyi,1990.0,Flow: The Psychology of Optimal Experience,Flow: The Psychology of Optimal Experience,eng,4.1,28619,32107,1485,605,1399,5507,11395,13201,https://s.gr-assets.com/assets/nophoto/book/111x148-bcc042a9c91a29c1d680899eff700a03.png
2953,2953,1184,2957,3,121732,21689,441,nonfiction,877675,77,6280838,9780000000000.0,C.S. Lewis,1955.0,Surprised by Joy: The Shape of My Early Life,Surprised by Joy: The Shape of My Early Life,eng,4.14,33698,35986,1156,612,1261,6142,12367,15604,https://images.gr-assets.com/books/1381407473m/121732.jpg
2956,2956,715,2960,4,95819,21689,18,nonfiction,366182,19,805005013,9780000000000.0,"Robert Frost, Edward Connery Lathem",1969.0,,"The Poetry of Robert Frost (Collected Poems, Complete & Unabridged)",eng,4.23,33525,34332,327,387,925,5294,11433,16293,https://s.gr-assets.com/assets/nophoto/book/111x148-bcc042a9c91a29c1d680899eff700a03.png
2959,2959,115,2963,4,53817,21689,188,nonfiction,1616396,40,310245656,9780000000000.0,Philip Yancey,1997.0,What's So Amazing About Grace?,What's So Amazing About Grace?,en-US,4.21,28501,29655,842,544,944,4374,9690,14103,https://images.gr-assets.com/books/1328050483m/53817.jpg
2963,2963,112,2967,4,9838,21689,136,nonfiction,1052584,92,316159417,9780000000000.0,"Åsne Seierstad, Ingrid Christopherson",2002.0,Bokhandleren i Kabul,The Bookseller of Kabul,en-US,3.76,30531,33890,2664,512,2168,9889,13752,7569,https://images.gr-assets.com/books/1388611939m/9838.jpg
2976,2976,579,2980,4,201114,21689,43,nonfiction,3231932,35,786851716,9780000000000.0,Patricia McCormick,2006.0,Sold,Sold,eng,4.19,36389,38446,4792,277,1069,6022,14839,16239,https://s.gr-assets.com/assets/nophoto/book/111x148-bcc042a9c91a29c1d680899eff700a03.png
3020,3020,632,3024,4,214614,21689,554,nonfiction,234706,37,345326490,9780000000000.0,Edward Abbey,1968.0,Desert Solitaire,Desert Solitaire,en-US,4.22,27723,29658,1826,469,1021,4255,9676,14237,https://images.gr-assets.com/books/1399583343m/214614.jpg
3022,3022,628,3026,5,56454,21689,365,nonfiction,55015,23,159562015X,9780000000000.0,Tom Rath,2007.0,Strengths Finder 2.0,Strengths Finder 2.0,en-US,3.92,30199,33076,1611,642,2035,7712,11697,10990,https://s.gr-assets.com/assets/nophoto/book/111x148-bcc042a9c91a29c1d680899eff700a03.png
3029,3029,185,3033,4,586472,21689,690,nonfiction,907221,44,553381350,9780000000000.0,Tom Wolfe,1979.0,The Right Stuff,The Right Stuff,eng,4.23,30701,32960,935,330,780,4710,12237,14903,https://images.gr-assets.com/books/1393654700m/586472.jpg
3042,3042,648,3046,2,603422,21689,100,nonfiction,589992,15,913668680,9780000000000.0,Mollie Katzen,1977.0,"The Moosewood Cookbook: Recipes from Moosewood Restaurant, Ithaca, New York","The Moosewood Cookbook: Recipes from Moosewood Restaurant, Ithaca, New York",eng,3.95,34502,36020,383,1080,2083,7568,11945,13344,https://images.gr-assets.com/books/1344370160m/603422.jpg
3045,3045,100,3049,4,78250,23471,224,philosophy,2029104,112,671227424,9780000000000.0,Carlos Castaneda,1968.0,The Teachings of Don Juan: A Yaqui Way of Knowledge,The Teachings of Don Juan: A Yaqui Way of Knowledge ,en-US,3.94,27784,30576,849,741,1884,6764,10389,10798,https://s.gr-assets.com/assets/nophoto/book/111x148-bcc042a9c91a29c1d680899eff700a03.png
3055,3055,861,3059,4,40745,21689,889,nonfiction,40330,49,1400062756,9780000000000.0,Carol S. Dweck,2006.0,Mindset: The New Psychology of Success,Mindset: The New Psychology of Success,en-US,4.04,31174,37162,3668,661,1889,7058,13356,14198,https://s.gr-assets.com/assets/nophoto/book/111x148-bcc042a9c91a29c1d680899eff700a03.png
3057,3057,168,3061,3,26435,21689,462,nonfiction,2976220,81,6280935,9780000000000.0,C.S. Lewis,1940.0,The Problem of Pain,The Problem of Pain,eng,4.12,29179,31440,1207,493,1065,5529,11394,12959,https://images.gr-assets.com/books/1328546308m/26435.jpg
3058,3058,1129,3062,4,2527900,21689,136,nonfiction,2535409,46,300122233,9780000000000.0,"Richard H. Thaler, Cass R. Sunstein",2008.0,"Nudge: Improving Decisions About Health, Wealth, and Happiness","Nudge: Improving Decisions About Health, Wealth, and Happiness",eng,3.8,29552,32763,1478,634,2277,8824,12271,8757,https://images.gr-assets.com/books/1328828013m/2527900.jpg
3065,3065,1149,3069,4,38315,21689,562,nonfiction,3119175,46,812975219,9780000000000.0,Nassim Nicholas Taleb,2001.0,Fooled by Randomness: The Hidden Role of Chance in Life and in the Markets,Fooled by Randomness: The Hidden Role of Chance in Life and in the Markets,eng,4.05,28674,30789,1207,565,1461,5571,11342,11850,https://s.gr-assets.com/assets/nophoto/book/111x148-bcc042a9c91a29c1d680899eff700a03.png
3070,3070,128,3074,4,16142053,21689,1550,nonfiction,21973918,24,307700666,9780000000000.0,Lawrence Wright,2013.0,"Going Clear: Scientology, Hollywood, and the Prison of Belief","Going Clear: Scientology, Hollywood, and the Prison of Belief",eng,4.02,26117,30503,3890,570,1134,5375,13495,9929,https://images.gr-assets.com/books/1358119149m/16142053.jpg
3081,3081,100,3085,3,5954,23471,173,philosophy,955995,214,374506841,9780000000000.0,"Hermann Hesse, Ursule Molinaro",1930.0,Narziß und Goldmund,Narcissus and Goldmund,eng,4.19,25544,32779,1318,319,1134,5204,11464,14658,https://images.gr-assets.com/books/1374680750m/5954.jpg
3115,3115,447,3119,5,3465,21689,324,nonfiction,7258,54,446694851,9780000000000.0,"Nicholas Sparks, Micah Sparks",2004.0,Three Weeks with My Brother,Three Weeks With My Brother,eng,4.01,32208,33910,2654,674,1880,6982,11287,13087,https://s.gr-assets.com/assets/nophoto/book/111x148-bcc042a9c91a29c1d680899eff700a03.png
3119,3119,40,3123,3,2159,21689,693,nonfiction,1734580,71,452287081,9780000000000.0,John Perkins,2004.0,Confessions of an Economic Hit Man,Confessions of an Economic Hit Man,en-US,3.83,19726,26245,3036,663,1851,6174,10056,7501,https://s.gr-assets.com/assets/nophoto/book/111x148-bcc042a9c91a29c1d680899eff700a03.png
3125,3125,5302,3129,4,6570502,21773,294,nonfiction,6763564,56,385528752,9780000000000.0,"Chip Heath, Dan Heath",2010.0,Switch: How to Change Things When Change Is Hard,Switch: How to Change Things When Change Is Hard,eng,4.02,26820,30210,2072,672,1379,5703,11524,10932,https://images.gr-assets.com/books/1422839688m/6570502.jpg
3145,3145,1030,3149,4,196613,21689,88,nonfiction,3378802,36,762424931,9780000000000.0,"Rory Freedman, Kim Barnouin",2005.0,"Skinny Bitch: A No-Nonsense, Tough-Love Guide for Savvy Girls Who Want to Stop Eating Crap and Start Looking Fabulous!",Skinny Bitch,en-US,3.34,26665,29089,4034,2817,4432,8117,7358,6365,https://s.gr-assets.com/assets/nophoto/book/111x148-bcc042a9c91a29c1d680899eff700a03.png
3148,3148,229,3152,5,2054761,21689,187,nonfiction,2059929,7,553805096,9780000000000.0,Alice Schroeder,2008.0,The Snowball: Warren Buffett and the Business of Life,The Snowball: Warren Buffett and the Business of Life,eng,4.05,27007,28104,912,875,1266,4806,9687,11470,https://images.gr-assets.com/books/1320458276m/2054761.jpg
3155,3155,3190,3159,5,1127996,21689,81,nonfiction,1425869,76,307098222,9780000000000.0,Betty Crocker,1969.0,Betty Crocker's Cookbook,Betty Crocker's Cookbook,eng,4.25,27892,29108,266,410,896,4740,8058,15004,https://images.gr-assets.com/books/1431198491m/1127996.jpg
3176,3176,16,3181,5,32525,21689,101,nonfiction,1166071,46,155050907,9780000000000.0,"Helen Gardner, Fred S. Kleiner, Christin J. Mamiya",1926.0,Art Through the Ages ,Art Through the Ages ,eng,3.84,23738,26181,136,1805,1934,5154,7003,10285,https://s.gr-assets.com/assets/nophoto/book/111x148-bcc042a9c91a29c1d680899eff700a03.png
3191,3191,2674,3196,4,801178,21689,218,nonfiction,1958046,91,1558749209,9780000000000.0,"Jack Canfield, Mark Victor Hansen",1993.0,Chicken Soup for the Soul,Chicken Soup for the Soul,eng,3.94,28664,30141,632,818,1850,6916,9273,11284,https://s.gr-assets.com/assets/nophoto/book/111x148-bcc042a9c91a29c1d680899eff700a03.png
3202,3202,307,3207,3,248787,21689,1571,nonfiction,241063,63,312347294,9780000000000.0,Alan Weisman,2007.0,The World Without Us,The World Without Us,eng,3.79,28549,30591,3048,745,2202,7770,11829,8045,https://s.gr-assets.com/assets/nophoto/book/111x148-bcc042a9c91a29c1d680899eff700a03.png
3217,3217,5132,3222,4,4452257,21689,204,nonfiction,4500484,6,034551176X,9780000000000.0,Bill Simmons,2009.0,The Book of Basketball: The NBA According to The Sports Guy,The Book of Basketball: The NBA According to The Sports Guy,en-US,4.16,24245,25096,838,735,1012,3838,7481,12030,https://images.gr-assets.com/books/1320424763m/4452257.jpg
3220,3220,3421,3225,5,634583,21689,121,nonfiction,620871,21,8173711461,9790000000000.0,"A.P.J. Abdul Kalam, Arun Tiwari",1999.0,Wings of Fire: An Autobiography,Wings of Fire: An Autobiography,en-US,4.19,24450,26675,848,258,785,4068,10002,11562,https://images.gr-assets.com/books/1295670969m/634583.jpg
3222,3222,11041,3227,4,13588394,21689,1118,nonfiction,19175796,33,159420411X,9780000000000.0,Nate Silver,2012.0,The Signal and the Noise: Why So Many Predictions Fail - But Some Don't,The Signal and the Noise: Why So Many Predictions Fail - But Some Don't,eng,3.96,26888,30613,2374,417,1355,6365,13246,9230,https://images.gr-assets.com/books/1355058876m/13588394.jpg
3263,3263,2205,3268,5,1128178,21689,1131,nonfiction,2915978,52,393061728,9780000000000.0,Diane Ackerman,2007.0,The Zookeeper's Wife: A War Story,The Zookeeper's Wife,eng,3.44,20056,46005,7070,1922,5882,15489,15445,7267,https://s.gr-assets.com/assets/nophoto/book/111x148-bcc042a9c91a29c1d680899eff700a03.png
3265,3265,348,3270,4,18170143,21689,1332,nonfiction,25488999,49,316253014,9780000000000.0,Chris Hadfield,2013.0,An Astronaut’s Guide to Life on Earth,An Astronaut's Guide to Life on Earth,eng,4.14,25474,29675,2831,627,1025,4534,10905,12584,https://images.gr-assets.com/books/1380495144m/18170143.jpg
3282,3282,162,3287,3,7015635,21689,1112,nonfiction,7261546,48,014311638X,9780000000000.0,Michael Pollan,2008.0,Food Rules,Food Rules: An Eater's Manual,en-US,3.99,30577,33151,3044,349,1485,7565,12460,11292,https://s.gr-assets.com/assets/nophoto/book/111x148-bcc042a9c91a29c1d680899eff700a03.png
3300,3300,8303,3305,5,7155145,21689,389,nonfiction,7421862,35,1591843162,9780000000000.0,Seth Godin,2010.0,Linchpin: Are You Indispensable?,Linchpin: Are You Indispensable?,en-US,3.87,26555,28121,1462,1014,1960,6021,9680,9446,https://s.gr-assets.com/assets/nophoto/book/111x148-bcc042a9c91a29c1d680899eff700a03.png
3303,3303,286,3308,3,4477,21689,767,nonfiction,2710546,31,312421702,9780000000000.0,"Atul Gawande, Susanne Kuhlmann-Krieg",2002.0,Complications: A Surgeon's Notes on an Imperfect Science,Complications: A Surgeon's Notes on an Imperfect Science,en-US,4.23,26267,27901,1977,168,579,3800,11337,12017,https://s.gr-assets.com/assets/nophoto/book/111x148-bcc042a9c91a29c1d680899eff700a03.png
3310,3310,14434,3315,3,17287028,21773,190,nonfiction,24036009,2,1250040159,9780000000000.0,"Elizabeth  Smart, Chris Stewart",2013.0,,My Story,eng,3.77,23294,25846,3604,1048,1889,6465,8899,7545,https://images.gr-assets.com/books/1367749530m/17287028.jpg
3330,3330,132,3335,3,12987640,21689,644,nonfiction,17907836,26,547386079,9780000000000.0,Jonah Lehrer,2012.0,,Imagine: How Creativity Works,eng,3.75,24727,25545,1706,1306,2001,6222,8246,7770,https://images.gr-assets.com/books/1327000473m/12987640.jpg
3333,3333,332,3338,5,6751,21689,1016,nonfiction,2207382,26,316156116,9780000000000.0,David Foster Wallace,2005.0,Consider the Lobster,Consider the Lobster and Other Essays,eng,4.25,26551,29562,2283,248,717,3541,11853,13203,https://s.gr-assets.com/assets/nophoto/book/111x148-bcc042a9c91a29c1d680899eff700a03.png
3337,3337,171,3342,5,11987,23471,368,philosophy,855563,35,679733736,9780000000000.0,"Albert Camus, Justin O'Brien",1942.0,Le Mythe de Sisyphe,The Myth of Sisyphus and Other Essays,eng,4.18,30221,30895,797,268,912,4970,11489,13256,https://images.gr-assets.com/books/1401656886m/11987.jpg
3344,3344,256,3349,5,6174,21689,22,nonfiction,851110,134,684826801,9780000000000.0,"Primo Levi, Stuart J. Woolf, Philip Roth",1947.0,Se questo è un uomo,Survival in Auschwitz,eng,4.28,25625,32801,1182,354,802,4436,11061,16148,https://images.gr-assets.com/books/1414374949m/6174.jpg
3351,3351,3067,3356,4,818811,21689,801,nonfiction,2782429,31,767927567,9780000000000.0,"Carolyn Jessop, Laura Palmer",2007.0,Escape,Escape,en-US,3.96,28581,30543,4148,348,1322,7112,12163,9598,https://s.gr-assets.com/assets/nophoto/book/111x148-bcc042a9c91a29c1d680899eff700a03.png
3356,3356,2748,3361,2,50937,21689,193,nonfiction,49725,38,684852861,9780000000000.0,"Marcus Buckingham, Curt Coffman",1998.0,"First, Break All the Rules: What the World's Greatest Managers Do Differently ","First, Break All the Rules: What the World's Greatest Managers Do Differently",eng,3.92,27207,27673,495,808,1521,6207,9707,9430,https://s.gr-assets.com/assets/nophoto/book/111x148-bcc042a9c91a29c1d680899eff700a03.png
3380,3380,5688,3385,5,6687247,21689,405,nonfiction,6882582,30,670021253,9780000000000.0,Andrew Ross Sorkin,2008.0,Too Big to Fail The Inside Story of How Wall Street and Washington Fought to Save the Financial System from Crisis - and Lost,Too Big to Fail: The Inside Story of How Wall Street and Washington Fought to Save the Financial System from Crisis — and Themselves,en-US,4.09,25493,27389,1142,340,991,4894,10929,10235,https://s.gr-assets.com/assets/nophoto/book/111x148-bcc042a9c91a29c1d680899eff700a03.png
3387,3387,449,3392,5,139855,21689,122,nonfiction,276686,30,083081650X,9780000000000.0,J.I. Packer,1973.0,Knowing God,Knowing God,eng,4.31,29848,30710,659,453,826,4007,8786,16638,https://s.gr-assets.com/assets/nophoto/book/111x148-bcc042a9c91a29c1d680899eff700a03.png
3408,3408,2282,3413,4,36071,21689,153,nonfiction,35982,64,684802031,9780000000000.0,"Stephen R. Covey, A. Roger Merrill, Rebecca R. Merrill",1993.0,"First Things First: To Live, to Love, to Learn, to Leave a Legacy",First Things First,eng,4.06,26813,27414,340,425,1034,5514,9840,10601,https://s.gr-assets.com/assets/nophoto/book/111x148-bcc042a9c91a29c1d680899eff700a03.png
3414,3414,406,3419,4,152519,21773,311,nonfiction,330710,341,486419312,9780000000000.0,Harriet Jacobs,1861.0,Incidents in the Life of a Slave Girl Written by Herself,Incidents in the Life of a Slave Girl,eng,4.08,24744,32172,1685,430,1287,6330,11468,12657,https://images.gr-assets.com/books/1418788224m/152519.jpg
3427,3427,15519,3432,4,18143905,21689,1117,nonfiction,25539400,27,147675361X,9780000000000.0,Marina Keegan,2014.0,The Opposite of Loneliness,The Opposite of Loneliness: Essays and Stories,eng,3.82,19771,31370,3394,581,2213,8325,11334,8917,https://images.gr-assets.com/books/1401056149m/18143905.jpg
3437,3437,6873,3442,4,13152287,21689,34,nonfiction,17885255,54,449010880,9780000000000.0,"Pamela Druckerman, Abby Craden",2012.0,Bringing up Bébé,Bringing Up Bébé: One American Mother Discovers the Wisdom of French Parenting,eng,3.95,18276,29616,3863,296,1121,6340,13941,7918,https://images.gr-assets.com/books/1327009243m/13152287.jpg
3438,3438,810,3443,3,6538,21689,633,nonfiction,1100254,68,425192733,9780000000000.0,Patricia Cornwell,2002.0,Portrait of a Killer: Jack The Ripper - Case Closed,Portrait of a Killer: Jack the Ripper - Case Closed,eng,3.44,28506,29768,1311,1998,4123,9041,7953,6653,https://s.gr-assets.com/assets/nophoto/book/111x148-bcc042a9c91a29c1d680899eff700a03.png
3446,3446,89,3451,4,46199,21689,776,nonfiction,1208289,220,486422453,9780000000000.0,"Rainer Maria Rilke, Reginald Snell, Franz Xaver Kappus",1929.0,Briefe an einen jungen Dichter,Letters to a Young Poet,en-US,4.34,25066,32449,2219,273,851,3971,9818,17536,https://images.gr-assets.com/books/1321994947m/46199.jpg
