,Unnamed: 0,user_id,book_id,rating,goodreads_book_id,tag_id,count,genre_x,work_id,books_count,isbn,isbn13,authors,original_publication_year,original_title,title,language_code,average_rating,ratings_count,work_ratings_count,work_text_reviews_count,ratings_1,ratings_2,ratings_3,ratings_4,ratings_5,image_url
4576,4576,171,4584,5,10037,23471,419,philosophy,1006752,21,679725164,9780000000000.0,"Jean-Paul Sartre, Stuart Gilbert, Lionel Abel",1947.0,No Exit and Three Other Plays,No Exit and Three Other Plays,eng,4.09,21841,22459,572,192,797,4309,8746,8415,https://s.gr-assets.com/assets/nophoto/book/111x148-bcc042a9c91a29c1d680899eff700a03.png
4586,4586,10306,4594,4,31845516,21689,392,nonfiction,48126510,20,1250128544,9780000000000.0,Glennon Doyle Melton,2016.0,Love Warrior,Love Warrior,en-US,4.1,20094,26061,3190,548,1293,4361,8772,11087,https://images.gr-assets.com/books/1473164102m/31845516.jpg
4590,4590,950,4598,2,45220,21689,64,nonfiction,3585,64,451160312,9780000000000.0,"Hannah  Green, Joanne Greenberg",1964.0,I Never Promised You a Rose Garden,I Never Promised You a Rose Garden,eng,3.85,22420,24924,727,382,1556,6837,8766,7383,https://images.gr-assets.com/books/1309209871m/45220.jpg
4593,4593,39748,4601,4,25690958,21689,708,nonfiction,45519636,24,,,Shonda Rhimes,2015.0,,"Year of Yes: How to Dance It Out, Stand In the Sun and Be Your Own Person",eng,4.05,25816,29603,3643,711,1454,5260,10269,11909,https://images.gr-assets.com/books/1443552148m/25690958.jpg
4612,4612,126,4620,4,781182,21689,254,nonfiction,1011004,31,60536357,9780000000000.0,"Bryan Burrough, John Helyar",1990.0,Barbarians at the Gate: The Fall of RJR Nabisco,Barbarians at the Gate: The Fall of RJR Nabisco,en-US,4.22,19176,20547,548,247,544,2941,7599,9216,https://s.gr-assets.com/assets/nophoto/book/111x148-bcc042a9c91a29c1d680899eff700a03.png
4614,4614,8,4622,5,17689,23471,29,philosophy,2206656,2,082221900X,9780000000000.0,"David Fishelson, Aaron Leichter, Max Brod, Franz Kafka",2003.0,Franz Kafka's The Castle,Franz Kafka's The Castle (Dramatization),eng,4.07,22321,22323,223,322,873,4346,8146,8636,https://images.gr-assets.com/books/1327873352m/17689.jpg
4626,4626,78,4634,4,16634,23471,173,philosophy,2959456,163,312278497,9780000000000.0,"Hermann Hesse, Richard Winston, Clara Winston, Theodore Ziolkowski",1943.0,Das Glasperlenspiel,The Glass Bead Game,eng,4.11,20198,23461,1069,484,1234,3919,7306,10518,https://s.gr-assets.com/assets/nophoto/book/111x148-bcc042a9c91a29c1d680899eff700a03.png
4630,4630,983,4638,5,48132,21689,493,nonfiction,76682,138,142004413,9780000000000.0,"Gerald Durrell, Helma Lapiņa",1956.0,My Family and Other Animals,"My Family and Other Animals (Corfu Trilogy, #1)",en-US,4.27,20057,23944,1892,259,739,3206,7909,11831,https://images.gr-assets.com/books/1327885239m/48132.jpg
4635,4635,6349,4643,4,1999475,21689,351,nonfiction,2003288,18,785213066,9780000000000.0,Donald Miller,2009.0,A Million Miles in a Thousand Years: What I Learned While Editing My Life,A Million Miles in a Thousand Years: What I Learned While Editing My Life,en-US,4.18,18963,20299,1868,249,759,3148,7143,9000,https://s.gr-assets.com/assets/nophoto/book/111x148-bcc042a9c91a29c1d680899eff700a03.png
4652,4652,447,4660,4,12540,21689,348,nonfiction,901072,12,1400079098,9780000000000.0,Anne Lamott,1993.0,Operating Instructions: A Journal of My Son's First Year,Operating Instructions: A Journal of My Son's First Year,eng,4.18,19466,20063,1631,218,658,3173,7178,8836,https://s.gr-assets.com/assets/nophoto/book/111x148-bcc042a9c91a29c1d680899eff700a03.png
4669,4669,580,4677,3,49158,21689,57,nonfiction,1491732,19,1590523172,9780000000000.0,Shaunti Feldhahn,2004.0,For Women Only: What You Need to Know about the Inner Lives of Men,For Women Only: What You Need to Know about the Inner Lives of Men,en-US,4.06,15385,20021,878,448,1090,3841,6139,8503,https://s.gr-assets.com/assets/nophoto/book/111x148-bcc042a9c91a29c1d680899eff700a03.png
4676,4676,171,4684,5,25698,21689,561,nonfiction,1373762,513,553585975,9780000000000.0,Adam Smith,1776.0,An Inquiry into the Nature and Causes of the Wealth of Nations ,The Wealth of Nations,eng,3.87,17180,20550,667,365,1331,5253,7277,6324,https://s.gr-assets.com/assets/nophoto/book/111x148-bcc042a9c91a29c1d680899eff700a03.png
4683,4683,219,4691,4,1624,21689,501,nonfiction,192528,54,865471185,9780000000000.0,Beryl Markham,1942.0,West with the Night,West with the Night,en-US,4.18,19738,21928,2226,268,712,3554,7631,9763,https://images.gr-assets.com/books/1368204688m/1624.jpg
4686,4686,7701,4694,3,9972053,21689,512,nonfiction,14866301,17,399157530,9780000000000.0,Betty White,2011.0,If You Ask Me: And of Course You Won't,If You Ask Me (And of Course You Won't),eng,3.65,22405,23426,2292,843,2269,7212,6985,6117,https://s.gr-assets.com/assets/nophoto/book/111x148-bcc042a9c91a29c1d680899eff700a03.png
4687,4687,116,4695,5,31862,23471,1321,philosophy,2342366,73,872204200,9780000000000.0,"René Descartes, Donald A. Cress",1637.0,Discours de la Méthode suivi de Méditations Métaphysiques,Discourse on Method and Meditations on First Philosophy,eng,3.67,20522,21289,306,651,1997,6288,7044,5309,https://images.gr-assets.com/books/1405624402m/31862.jpg
4691,4691,156,4699,4,68143,21689,388,nonfiction,3250675,38,385721706,9780000000000.0,James Surowiecki,2004.0,The Wisdom of Crowds,The Wisdom of Crowds,eng,3.8,18457,19282,627,421,1364,5148,7135,5214,https://s.gr-assets.com/assets/nophoto/book/111x148-bcc042a9c91a29c1d680899eff700a03.png
4698,4698,2607,4706,4,18594409,21689,451,nonfiction,26340807,10,1608198065,9780000000000.0,Roz Chast,2014.0,Can't We Talk about Something More Pleasant?,Can't We Talk about Something More Pleasant?,eng,4.1,19118,19756,3156,803,842,2705,6635,8771,https://images.gr-assets.com/books/1421087235m/18594409.jpg
4699,4699,73,4707,4,37847,21689,344,nonfiction,37641,25,60987464,9780000000000.0,"Marilyn Manson, Neil Strauss",1998.0,The Long Hard Road Out of Hell,The Long Hard Road Out of Hell,eng,3.88,19011,20277,1034,631,1518,4598,6382,7148,https://s.gr-assets.com/assets/nophoto/book/111x148-bcc042a9c91a29c1d680899eff700a03.png
4713,4713,7096,4721,5,3116205,21689,91,nonfiction,3147524,27,525950796,9780000000000.0,Timothy J. Keller,2008.0,The Prodigal God: Christianity Redefined Through the Parable of the Prodigal Sons,The Prodigal God: Recovering the Heart of the Christian Faith,en-US,4.39,20087,21613,1295,224,452,2163,6640,12134,https://images.gr-assets.com/books/1427212055m/3116205.jpg
4714,4714,384,4722,5,44255,21689,185,nonfiction,3123857,35,679736042,9780000000000.0,Peter Mayle,1991.0,Toujours Provence,Toujours Provence,eng,4.0,21873,22335,371,157,798,5304,8767,7309,https://images.gr-assets.com/books/1411874268m/44255.jpg
4715,4715,751,4723,4,27398,21689,256,nonfiction,1054249,28,375759867,9780000000000.0,Jonathan Harr,2005.0,The Lost Painting: The Quest for a Caravaggio Masterpiece,The Lost Painting,en-US,3.71,18944,19555,769,1034,1900,4883,5545,6193,https://s.gr-assets.com/assets/nophoto/book/111x148-bcc042a9c91a29c1d680899eff700a03.png
4717,4717,31149,4725,4,13642929,21689,420,nonfiction,21520935,20,307594882,9780000000000.0,Sonia Sotomayor,2013.0,,My Beloved World,eng,4.03,17742,20156,2789,510,769,3476,8242,7159,https://images.gr-assets.com/books/1348791624m/13642929.jpg
4719,4719,116,4727,3,18288,23471,2206,philosophy,1072226,383,521657296,9780000000000.0,"Immanuel Kant, Paul Guyer, Allen W. Wood",1781.0,Kritik der reinen Vernunft,Critique of Pure Reason,eng,3.92,19521,21509,454,688,1489,4643,6790,7899,https://s.gr-assets.com/assets/nophoto/book/111x148-bcc042a9c91a29c1d680899eff700a03.png
4725,4725,404,4733,4,385228,21689,462,nonfiction,2387235,410,140432078,9780000000000.0,John Stuart Mill,1859.0,On Liberty,On Liberty,eng,3.93,19604,21567,566,344,1201,5117,7759,7146,https://images.gr-assets.com/books/1459346459m/385228.jpg
4726,4726,26433,4734,4,22934446,21689,754,nonfiction,37100610,20,62225073,9780000000000.0,Alan Cumming,2014.0,Not My Father's Son,Not My Father's Son,eng,4.0,11436,23330,3202,424,935,4437,9923,7611,https://images.gr-assets.com/books/1429218612m/22934446.jpg
4727,4727,2038,4735,4,468070,21689,68,nonfiction,947480,28,1401322433,9780000000000.0,Nigella Lawson,2007.0,Nigella Express: Good Food Fast,"Nigella Express: Good Food, Fast",eng,3.96,20034,20292,198,553,1078,4453,6801,7407,https://s.gr-assets.com/assets/nophoto/book/111x148-bcc042a9c91a29c1d680899eff700a03.png
4732,4732,239,4740,4,213233,21689,509,nonfiction,1573617,26,805082115,9780000000000.0,Atul Gawande,2007.0,Better: A Surgeon's Notes on Performance,Better: A Surgeon's Notes on Performance,en-US,4.19,17109,19064,1579,90,390,2914,8043,7627,https://s.gr-assets.com/assets/nophoto/book/111x148-bcc042a9c91a29c1d680899eff700a03.png
4735,4735,9232,4743,5,6441654,23471,22,philosophy,6631596,11,470484233,9780000000000.0,"Rebecca Housel, J. Jeremy Wisnewski, William Irwin",2009.0,"Twilight and Philosophy: Vampires, Vegetarians, and the Pursuit of Immortality (The Blackwell Philosophy and Pop Culture Series)","Twilight and Philosophy: Vampires, Vegetarians, and the Pursuit of Immortality",en-US,4.39,18027,18054,39,444,651,2157,2953,11849,https://s.gr-assets.com/assets/nophoto/book/111x148-bcc042a9c91a29c1d680899eff700a03.png
4736,4736,1033,4744,3,49176,21773,65,nonfiction,817417,79,345032799,9780000000000.0,Eric Berne,1964.0,Games People Play,Games People Play,en-US,3.81,17035,19189,596,415,1483,5128,6427,5736,https://s.gr-assets.com/assets/nophoto/book/111x148-bcc042a9c91a29c1d680899eff700a03.png
4740,4740,4188,4748,3,206309,21689,147,nonfiction,1138219,47,786866020,9780000000000.0,"Stephen C. Lundin, Harry Paul, John Christensen, Kenneth H. Blanchard",1996.0,Fish! A Remarkable Way to Boost Morale and Improve Results,Fish: A Proven Way to Boost Morale and Improve Results,eng,3.92,19405,20340,770,466,1291,4735,6684,7164,https://images.gr-assets.com/books/1393219562m/206309.jpg
4751,4751,801,4759,3,54529,21689,394,nonfiction,1429862,49,767903579,9780000000000.0,Adeline Yen Mah,1997.0,Falling Leaves: The Memoir of an Unwanted Chinese Daughter,Falling Leaves: The Memoir of an Unwanted Chinese Daughter,eng,3.88,19598,21301,1636,317,1123,5386,8488,5987,https://images.gr-assets.com/books/1423952608m/54529.jpg
4754,4754,12709,4762,4,7148931,21689,117,nonfiction,7413929,38,030746363X,9780000000000.0,Timothy Ferriss,2000.0,The 4-Hour Body,"The 4-Hour Body: An Uncommon Guide to Rapid Fat-Loss, Incredible Sex, and Becoming Superhuman",en-US,3.76,15007,20858,1367,569,1711,5386,7654,5538,https://images.gr-assets.com/books/1351861578m/7148931.jpg
4755,4755,136,4763,2,58314,23471,38,philosophy,2595873,116,375727019,9780000000000.0,"Michel Houellebecq, Frank Wynne",1998.0,Les Particules élémentaires,The Elementary Particles,eng,3.78,13577,21691,1317,794,1747,4883,8198,6069,https://images.gr-assets.com/books/1403180525m/58314.jpg
4759,4759,922,4767,4,13435889,21689,684,nonfiction,18938981,37,547564651,9780000000000.0,Paul Tough,2012.0,"How Children Succeed: Grit, Curiosity, and the Hidden Power of Character","How Children Succeed: Grit, Curiosity, and the Hidden Power of Character",eng,3.91,16402,18145,1947,323,872,4268,7381,5301,https://images.gr-assets.com/books/1344730141m/13435889.jpg
4770,4770,1723,4778,5,5883777,21689,100,nonfiction,21899016,627,,,Anonymous,2001.0,Holy Bible English Standard Version,The Holy Bible: English Standard Version,eng,4.66,17863,23236,591,652,431,1082,1909,19162,https://images.gr-assets.com/books/1328227151m/5883777.jpg
4772,4772,1846,4780,3,233389,21689,127,nonfiction,790136,92,019283410X,9780000000000.0,"Giorgio Vasari, Julia Conway Bondanella, Peter Bondanella",1550.0,"Le Vite de' più eccellenti pittori, scultori, e architettori da Cimabue insino a' tempi nostri",The Lives of the Artists,eng,3.78,18288,18738,106,1162,1589,4059,5271,6657,https://s.gr-assets.com/assets/nophoto/book/111x148-bcc042a9c91a29c1d680899eff700a03.png
4777,4777,3676,4785,5,207781,21689,48,nonfiction,437807,14,64301389,9780000000000.0,"Robert Henri, Forbes Watson, Margery A. Ryerson",1929.0,"The Art Spirit: Notes, Articles, Fragments of Letters and Talks to Students, Bearing on the Concept and Technique of Picture Making, the Study of Art Generally, and on Appreciation (Icon Editions)","The Art Spirit: Notes, Articles, Fragments of Letters and Talks to Students, Bearing on the Concept and Technique of Picture Making, the Study of Art (Icon Editions)",eng,3.87,16333,16547,130,844,1426,3427,4138,6712,https://s.gr-assets.com/assets/nophoto/book/111x148-bcc042a9c91a29c1d680899eff700a03.png
4788,4788,607,4796,3,29254,23471,170,philosophy,29717,14,517543052,9780000000000.0,"Ram Dass, Richard Alpert",1971.0,Be Here Now,Be Here Now,en-US,4.27,18275,18669,598,268,616,2724,5214,9847,https://images.gr-assets.com/books/1369858407m/29254.jpg
4795,4795,2264,4803,4,17660462,21689,276,nonfiction,24650037,54,316219266,9780000000000.0,Brad Stone,2013.0,,The Everything Store: Jeff Bezos and the Age of Amazon,eng,4.06,20539,24678,1577,391,774,4261,10710,8542,https://images.gr-assets.com/books/1365394361m/17660462.jpg
4813,4813,926,4822,4,26596,21689,4,nonfiction,175882,6,871401525,9780000000000.0,E.E. Cummings,1991.0,E.E. Cummings: Complete Poems 1904-1962,"Complete Poems, 1904-1962",eng,4.35,18662,18814,196,203,429,2315,5491,10376,https://images.gr-assets.com/books/1355093052m/26596.jpg
4814,4814,581,4823,3,1635,21689,31,nonfiction,1436710,37,609610570,9780000000000.0,"Larry Bossidy, Ram Charan, Charles Burck",2009.0,,Execution: The Discipline of Getting Things Done,en-US,3.83,18065,18545,313,502,1362,4635,6322,5724,https://images.gr-assets.com/books/1350857284m/1635.jpg
4815,4815,7634,4824,5,20663702,21689,1355,nonfiction,39962326,23,393240231,9780000000000.0,Caitlin Doughty,2014.0,Smoke Gets in Your Eyes: And Other Lessons from the Crematory,Smoke Gets in Your Eyes: And Other Lessons from the Crematory,eng,4.04,10979,21669,3029,550,941,3694,8369,8115,https://images.gr-assets.com/books/1416181987m/20663702.jpg
4834,4834,4799,4843,3,15797397,21689,1202,nonfiction,21520265,39,1400069807,9780000000000.0,Michael Moss,2013.0,Salt Sugar Fat: How the Food Giants Hooked Us ,Salt Sugar Fat: How the Food Giants Hooked Us,eng,3.98,18542,20455,2615,407,876,4094,8465,6613,https://images.gr-assets.com/books/1361919312m/15797397.jpg
4839,4839,1132,4848,5,368916,21689,1097,nonfiction,938626,64,140143505,9780000000000.0,Helene Hanff,1970.0,"84, Charing Cross Road","84, Charing Cross Road",eng,4.19,26899,29517,4095,163,779,4650,11589,12336,https://images.gr-assets.com/books/1287338794m/368916.jpg
4841,4841,1392,4850,3,14572,21689,298,nonfiction,870836,43,553351397,9780000000000.0,"Thich Nhat Hanh, Arnold Kotler, Dalai Lama XIV",1990.0,Peace Is Every Step: The Path of Mindfulness in Everyday Life,Peace Is Every Step: The Path of Mindfulness in Everyday Life,eng,4.34,19152,19516,890,145,400,2396,6295,10280,https://images.gr-assets.com/books/1320544155m/14572.jpg
4843,4843,51697,4852,4,29868610,21689,1152,nonfiction,45352758,19,1501117203,9780000000000.0,Anna Kendrick,2016.0,Scrappy Little Nobody,Scrappy Little Nobody,eng,3.91,28719,32610,4278,275,1415,7792,14453,8675,https://images.gr-assets.com/books/1469410391m/29868610.jpg
4852,4852,178,4861,3,33333,21689,193,nonfiction,33415,17,785263713,9780000000000.0,Donald Miller,2000.0,Searching for God Knows What,Searching for God Knows What,en-US,3.92,19383,19696,704,432,1096,4533,7128,6507,https://s.gr-assets.com/assets/nophoto/book/111x148-bcc042a9c91a29c1d680899eff700a03.png
4870,4870,5295,4879,3,15827066,21689,716,nonfiction,21737662,28,62248472,9780000000000.0,"Jenna Miscavige Hill, Lisa Pulitzer",2013.0,Beyond Belief: My Secret Life Inside Scientology and My Harrowing Escape,Beyond Belief: My Secret Life Inside Scientology and My Harrowing Escape,eng,3.72,12643,21461,2487,483,1574,6319,8184,4901,https://images.gr-assets.com/books/1354001608m/15827066.jpg
4871,4871,116,4880,5,73945,23471,1350,philosophy,1692879,306,865163480,9780000000000.0,"Plato, James J. Helm",-390.0,Απολογία,Apology,eng,4.15,18261,22265,671,301,818,3836,7668,9642,https://s.gr-assets.com/assets/nophoto/book/111x148-bcc042a9c91a29c1d680899eff700a03.png
4881,4881,4018,4890,4,124524,21689,59,nonfiction,119915,39,310240018,9780000000000.0,"Joni Eareckson Tada, Joe Musser",1976.0,Joni,Joni: An Unforgettable Story,en-US,4.23,20191,20697,244,254,528,3428,6484,10003,https://images.gr-assets.com/books/1360187347m/124524.jpg
4885,4885,66,4894,5,582533,21689,113,nonfiction,1584982,53,1577312295,9780000000000.0,Shakti Gawain,1978.0,Creative Visualization: Use the Power of Your Imagination to Create What You Want in Your Life,Creative Visualization: Use the Power of Your Imagination to Create What You Want in Your Life,eng,4.13,17811,18451,320,299,797,3397,5721,8237,https://s.gr-assets.com/assets/nophoto/book/111x148-bcc042a9c91a29c1d680899eff700a03.png
4898,4898,1541,4908,5,900,21689,418,nonfiction,387,44,60554738,9780060554740.0,Neil Strauss,2005.0,The Game,The Game: Penetrating the Secret Society of Pickup Artists,en-US,3.73,16698,19145,1517,702,1643,4766,6953,5081,https://images.gr-assets.com/books/1410129471m/900.jpg
4922,4922,7277,4932,1,6340016,21689,259,nonfiction,6526004,15,60596988,9780000000000.0,Mary Karr,2008.0,Lit,Lit,eng,3.88,17964,19543,1928,483,1357,4297,7339,6067,https://s.gr-assets.com/assets/nophoto/book/111x148-bcc042a9c91a29c1d680899eff700a03.png
4928,4928,257,4939,3,22904,23471,64,philosophy,568437,70,805210555,9780000000000.0,"Franz Kafka, Nahum N. Glatzer, John Updike, Willa Muir, Edwin Muir, Tania Stern, James Stern, Ernst Kaiser, Eithne Wilkins",1946.0,Sämtliche Erzählungen,The Complete Stories,eng,4.34,18314,20541,485,201,454,2373,6549,10964,https://images.gr-assets.com/books/1223588017m/22904.jpg
4942,4942,44525,4953,3,18176747,21689,111,nonfiction,25548865,20,62273205,9780000000000.0,Ben Horowitz,2014.0,The Hard Thing about Hard Things: Building A Business When There Are No Easy Answers,The Hard Thing About Hard Things: Building a Business When There Are No Easy Answers,eng,4.2,19492,22549,1300,413,779,3215,7627,10515,https://images.gr-assets.com/books/1386609333m/18176747.jpg
4945,4945,5435,4956,2,2063563,21689,87,nonfiction,2068781,22,340936150,9780000000000.0,Russell Brand,2007.0,My Booky Wook,My Booky Wook,en-GB,3.42,16553,20083,1564,1055,2526,6732,6505,3265,https://s.gr-assets.com/assets/nophoto/book/111x148-bcc042a9c91a29c1d680899eff700a03.png
4947,4947,11626,4958,4,10909804,21689,719,nonfiction,10270290,33,1592406521,9780000000000.0,Simon Garfield,2010.0,Just My Type: A Book About Fonts,Just My Type: A Book About Fonts,en-US,3.79,22046,23329,1176,1126,1938,5496,6966,7803,https://images.gr-assets.com/books/1327886002m/10909804.jpg
4949,4949,632,4960,4,23534,21689,8,nonfiction,2640266,30,876853629,9780000000000.0,Charles Bukowski,1977.0,"Love Is a Dog from Hell: Poems, 1974-1977",Love Is a Dog from Hell,eng,4.16,19471,20725,896,368,723,3220,7241,9173,https://images.gr-assets.com/books/1377260823m/23534.jpg
4970,4970,115,4981,5,87665,21689,64,nonfiction,1807543,430,160096527X,9780000000000.0,G.K. Chesterton,1908.0,Orthodoxy,Orthodoxy,eng,4.23,18303,21429,1176,481,787,2858,6402,10901,https://s.gr-assets.com/assets/nophoto/book/111x148-bcc042a9c91a29c1d680899eff700a03.png
4983,4983,167,4994,4,11466,21689,286,nonfiction,1559134,37,802136680,9780000000000.0,Tobias Wolff,1989.0,This Boy's Life: A Memoir,This Boy's Life,eng,3.98,19981,21010,1201,257,953,4430,8727,6643,https://s.gr-assets.com/assets/nophoto/book/111x148-bcc042a9c91a29c1d680899eff700a03.png
4994,4994,1749,5005,3,46674,21773,115,nonfiction,1892311,42,380810336,9780000000000.0,David D. Burns,1980.0, Feeling Good: The New Mood Therapy,Feeling Good: The New Mood Therapy,en-US,3.95,17065,18208,540,584,1127,3881,5692,6924,https://s.gr-assets.com/assets/nophoto/book/111x148-bcc042a9c91a29c1d680899eff700a03.png
5001,5001,8966,5012,4,6496815,21689,844,nonfiction,6688299,39,446504122,9780000000000.0,"Po Bronson, Ashley Merryman",2008.0,NurtureShock: New Thinking About Children,NurtureShock: New Thinking About Children,en-US,4.04,17310,20054,2789,218,733,3803,8585,6715,https://s.gr-assets.com/assets/nophoto/book/111x148-bcc042a9c91a29c1d680899eff700a03.png
5020,5020,24415,5031,5,18114068,21689,105,nonfiction,25441299,31,1594204993,9780000000000.0,Phil Klay,2014.0,Redeployment,Redeployment,eng,3.98,15597,18114,2535,284,843,3662,7575,5750,https://images.gr-assets.com/books/1417987993m/18114068.jpg
5024,5024,128,5035,4,9530,21689,360,nonfiction,1267146,33,965925072,9780000000000.0,Robert Kurson,2004.0,Shadow Divers: The True Adventure of Two Americans Who Risked Everything to Solve One of the Last Mysteries of World War II,Shadow Divers,eng,4.26,16917,19263,1766,185,419,2485,7204,8970,https://s.gr-assets.com/assets/nophoto/book/111x148-bcc042a9c91a29c1d680899eff700a03.png
5042,5042,13300,5053,5,11391817,21689,68,nonfiction,16323867,4,545176867,9780000000000.0,Allen Say,2011.0,,Drawing from Memory,eng,3.81,21137,21140,346,1140,1939,4719,5254,8088,https://images.gr-assets.com/books/1328837508m/11391817.jpg
5048,5048,3199,5059,3,10115852,21689,296,nonfiction,15013397,24,006204964X,9780000000000.0,Rob Bell,2011.0,Love wins,"Love Wins: A Book About Heaven, Hell, and the Fate of Every Person Who Ever Lived",eng,3.54,17668,19093,1979,2184,1771,4050,5805,5283,https://images.gr-assets.com/books/1327878550m/10115852.jpg
5059,5059,3212,5070,5,178788,21689,26,nonfiction,544922,55,1932100660,9780000000000.0,"T. Colin Campbell, Thomas M. Campbell II",2001.0,"The China Study: The Most Comprehensive Study of Nutrition Ever Conducted and the Startling Implications for Diet, Weight Loss and Long-term Health","The China Study: The Most Comprehensive Study of Nutrition Ever Conducted And the Startling Implications for Diet, Weight Loss, And Long-term Health",en-GB,4.21,16485,18454,2165,322,688,2629,5945,8870,https://images.gr-assets.com/books/1376474019m/178788.jpg
5076,5076,24557,5087,3,16131193,21689,693,nonfiction,21956738,21,1455503258,9780000000000.0,Lily Koppel,2013.0,The Astronaut Wives Club,The Astronaut Wives Club,eng,3.26,17837,20282,3346,1364,3301,7092,5662,2863,https://images.gr-assets.com/books/1352436564m/16131193.jpg
5078,5078,940,5089,3,764903,21689,325,nonfiction,1925199,82,006008460X,9780000000000.0,"Frank B. Gilbreth Jr., Ernestine Gilbreth Carey",1948.0,Cheaper by the Dozen,Cheaper by the Dozen,eng,3.99,26266,28494,1557,355,1284,6465,10435,9955,https://s.gr-assets.com/assets/nophoto/book/111x148-bcc042a9c91a29c1d680899eff700a03.png
5079,5079,3233,5090,3,2198274,21773,381,nonfiction,2204022,53,446581194,9780000000000.0,"Douglas Preston, Mario Spezi",2008.0,The Monster of Florence: A True Story,The Monster of Florence,en-US,3.72,21548,23310,2423,443,1799,6746,9163,5159,https://images.gr-assets.com/books/1306075698m/2198274.jpg
5083,5083,3364,5094,4,1734639,21689,95,nonfiction,1732127,19,61251348,9780000000000.0,Jessica Seinfeld,2007.0,Deceptively Delicious: Simple Secrets to Get Your Kids Eating Good Food,Deceptively Delicious: Simple Secrets to Get Your Kids Eating Good Food,en-US,3.39,17837,18106,671,1390,2619,5606,4596,3895,https://s.gr-assets.com/assets/nophoto/book/111x148-bcc042a9c91a29c1d680899eff700a03.png
5090,5090,34,5101,4,11472,21689,919,nonfiction,888905,33,312243359,9780000000000.0,Philip Gourevitch,1998.0,We Wish to Inform You That Tomorrow We Will Be Killed with Our Families,We Wish to Inform You That Tomorrow We Will Be Killed with Our Families,en-US,4.3,18716,19546,1331,205,420,2329,6920,9672,https://s.gr-assets.com/assets/nophoto/book/111x148-bcc042a9c91a29c1d680899eff700a03.png
5097,5097,1890,5108,3,82751,21689,561,nonfiction,1429851,29,440228654,9780000000000.0,Adeline Yen Mah,1999.0,Chinese Cinderella: The True Story of an Unwanted Daughter,Chinese Cinderella: The True Story of an Unwanted Daughter,en-US,4.04,21410,24097,2241,300,995,4798,9366,8638,https://s.gr-assets.com/assets/nophoto/book/111x148-bcc042a9c91a29c1d680899eff700a03.png
5108,5108,1767,5119,4,1207904,21689,178,nonfiction,3219177,40,038551851X,9780000000000.0,Eric Clapton,2007.0,Clapton: The Autobiography,Clapton: The Autobiography,en-US,3.81,16369,18337,1272,321,1293,4948,6766,5009,https://s.gr-assets.com/assets/nophoto/book/111x148-bcc042a9c91a29c1d680899eff700a03.png
5109,5109,340,5120,5,647,21689,973,nonfiction,621375,73,312421435,9780312421430.0,Naomi Klein,1999.0,No Logo,No Logo,en-US,3.86,18792,20634,767,415,1279,4865,8205,5870,https://s.gr-assets.com/assets/nophoto/book/111x148-bcc042a9c91a29c1d680899eff700a03.png
5111,5111,270,5122,4,7748,21689,392,nonfiction,273425,22,446698229,9780000000000.0,Hunter S. Thompson,1973.0,Fear and Loathing on the Campaign Trail '72,Fear and Loathing on the Campaign Trail '72,en-US,4.1,15306,16602,701,85,562,3216,6417,6322,https://s.gr-assets.com/assets/nophoto/book/111x148-bcc042a9c91a29c1d680899eff700a03.png
5121,5121,34450,5132,4,16054811,23471,71,philosophy,21507847,84,385349831,9780000000000.0,"Paulo Coelho, Margaret Jull Costa",2012.0,Manuscrito encontrado em Accra,Manuscript Found in Accra,en-US,3.8,14318,18190,2093,654,1654,4277,5608,5997,https://images.gr-assets.com/books/1362586181m/16054811.jpg
5143,5143,5004,5154,5,6952423,21689,189,nonfiction,7187129,39,446569895,9780000000000.0,"Ozzy Osbourne, Chris Ayres",2009.0,I Am Ozzy,I Am Ozzy,en-US,4.05,16922,17959,1028,509,847,3207,5998,7398,https://s.gr-assets.com/assets/nophoto/book/111x148-bcc042a9c91a29c1d680899eff700a03.png
5144,5144,444,5155,5,11077,21689,431,nonfiction,713460,26,767915305,9780000000000.0,J. Maarten Troost,2003.0,The Sex Lives of Cannibals: Adrift in the Equatorial Pacific,The Sex Lives of Cannibals: Adrift in the Equatorial Pacific,eng,3.87,16954,17710,2016,332,1076,4235,7029,5038,https://s.gr-assets.com/assets/nophoto/book/111x148-bcc042a9c91a29c1d680899eff700a03.png
